{
  "connector_id": "ifc_22222222222222222222222222222222",
  "connector_protocol_version": 1,
  "credential_scope_sha256": "bbbbbbbbbbbbbbbbbbbbbbbbbbbbbbbbbbbbbbbbbbbbbbbbbbbbbbbbbbbbbbbb",
  "deadline": "2026-10-15T20:00:00.000000+00:00",
  "deployment_sha256": "aaaaaaaaaaaaaaaaaaaaaaaaaaaaaaaaaaaaaaaaaaaaaaaaaaaaaaaaaaaaaaaa",
  "error_code": null,
  "grant_id": "pgr_33333333333333333333333333333333",
  "invocation_id": "pinv_11111111111111111111111111111111",
  "model": "gpt-test",
  "outcome": "succeeded",
  "policy_sha256": "cccccccccccccccccccccccccccccccccccccccccccccccccccccccccccccccc",
  "protocol": "openai-responses",
  "provider": "openai",
  "provider_status": 200,
  "request_bytes": 83,
  "request_limit_bytes": 16384,
  "response": {
    "output_text": "done"
  },
  "response_bytes": 32,
  "response_limit_bytes": 32768,
  "route": "chatgpt-main",
  "schema_version": 1
}
